name,suplente,area,party,image,term,source
H.D. FLORENTINO ABREGO LEZCANO,"Morales Beitía, Hernán Antonio",4-1,Partido Panameñista,"http://www.asamblea.gob.pa/fotdip/xH.D,P20FLORENTINO_ABREGO2_PWC.jpg.pagespeed.ic.8EdX9RlUzD.jpg",2014,http://www.asamblea.gob.pa/diputados/
H.D. YANIBEL ABREGO SMITH,"Rodríguez Medina, Maximino",8-2,Partido Cambio Democrático,http://www.asamblea.gob.pa/fotdip/xHD_YANIBEL_ABREGO-PWC.jpg.pagespeed.ic.j4u9hw8u_K.jpg,2014,http://www.asamblea.gob.pa/diputados/
H.D. CRISPIANO ADAMES NAVARRO,"Ríos Herazo, Irving Ameth",8-7,Partido Revolucionario Democrático,http://www.asamblea.gob.pa/fotdip/xHD_CRISPIANO_ADAMES_PWC.jpg.pagespeed.ic.uDuwAmmSsR.jpg,2014,http://www.asamblea.gob.pa/diputados/
H.D. CARLOS AGUSTIN AFU DECEREGA,"Afu Brandao, Carlos Agustín",7-1,Partido Cambio Democrático,http://www.asamblea.gob.pa/fotdip/xHD_CARLOS_AFU_PWC.jpg.pagespeed.ic.zwboZYRwJU.jpg,2014,http://www.asamblea.gob.pa/diputados/
H.D. FRANCISCO JOSE ALEMAN MENDOZA,"González Camarena, Maira Esther",8-6,Partido Molirena,http://www.asamblea.gob.pa/fotdip/xHD_FRANCISCO_ALEMAN_PWC.jpg.pagespeed.ic.HCxuiA8E20.jpg,2014,http://www.asamblea.gob.pa/diputados/
H.D. HECTOR EDUARDO APARICIO DIAZ,"Aizpurua Adames, Manuel Enrique",9-2,Partido Molirena,http://www.asamblea.gob.pa/fotdip/xHD_HECTOR_APARICIO_PWC.jpg.pagespeed.ic.RcuBDKSzDV.jpg,2014,http://www.asamblea.gob.pa/diputados/
H.D. JUAN CARLOS ARANGO REESE,"Vergara Cárdenas, Edwin Emilio",8-3,Partido Popular,http://www.asamblea.gob.pa/fotdip/xHD_JUAN_C_ARANGO_PWC.jpg.pagespeed.ic.oXKjQQZHm2.jpg,2014,http://www.asamblea.gob.pa/diputados/
H.D. RONY RONALD ARAUZ GONZALEZ,"Araúz, Eric Nelson",4-6,Partido Cambio Democrático,http://www.asamblea.gob.pa/fotdip/xHD_RONY_ARAUZ_PWC.jpg.pagespeed.ic.9O4PPnHYod.jpg,2014,http://www.asamblea.gob.pa/diputados/
H.D. JORGE IVAN ARROCHA ROSARIO,"Pascual Otero, Dionicio",2-1,Partido Panameñista,http://www.asamblea.gob.pa/fotdip/xHD_JORGE_I_ARROCHA_PWC.jpg.pagespeed.ic.7XZMQFEtIg.jpg,2014,http://www.asamblea.gob.pa/diputados/
H.D. ATHENAS ATHANASIADIS ROJAS,"Rojas Espinosa, Alejandro",4-5,Partido Revolucionario Democrático,"http://www.asamblea.gob.pa/fotdip/xH.D,P20ATHENAS_ATHANASIADES_PWC.jpg.pagespeed.ic.6BJYhrFzve.jpg",2014,http://www.asamblea.gob.pa/diputados/
H.D. LEANDRO AVILA,"Caballero Hurtado, Cristian Nivaldo",8-6,Partido Revolucionario Democrático,http://www.asamblea.gob.pa/fotdip/xHD_LEANDRO_AVILA_PWC.jpg.pagespeed.ic.3551BlCLAO.jpg,2014,http://www.asamblea.gob.pa/diputados/
H.D. ROBERTO ANTONIO AYALA,"Díaz Sánchez, Diomedes Jacinto",8-5,Partido Revolucionario Democrático,http://www.asamblea.gob.pa/fotdip/xHD_ROBERTO_AYALA_PWC.jpg.pagespeed.ic.ZE_4vLs07b.jpg,2014,http://www.asamblea.gob.pa/diputados/
H.D. IRACEMA AYARZA DE,"Cerezo Rodríguez, Ricardo Zoilo",3-1,Partido Revolucionario Democrático,http://www.asamblea.gob.pa/fotdip/HD_IRACEMA_DE_DALE_PWC-jpg,2014,http://www.asamblea.gob.pa/diputados/
H.D. LUIS ALEXANDER BARRIA MOSCOSO,"Guardia Quijada, David Victoriano",8-9,Partido Panameñista,http://www.asamblea.gob.pa/fotdip/xHD_LUIS_BARRIA_PWC.jpg.pagespeed.ic.tgw-Bemxlo.jpg,2014,http://www.asamblea.gob.pa/diputados/
H.D. DALIA M. BERNAL Y,"Moreno Olivares, Boris Edgardo",8-6,Partido Cambio Democrático,http://www.asamblea.gob.pa/fotdip/xHD_DALIA_BERNAL_PWC.jpg.pagespeed.ic.Fz3RhxQmcM.jpg,2014,http://www.asamblea.gob.pa/diputados/
H.D. ROSA CANTO,"González Bedoya, José Higinio",8-1,Partido Revolucionario Democrático,http://www.asamblea.gob.pa/fotdip/xHD_ROSA_CANTO_PWC.jpg.pagespeed.ic.Yf7t32ngfa.jpg,2014,http://www.asamblea.gob.pa/diputados/
H.D. FERNANDO GUILLERMO CARRILLO SILVESTRI,"Ringrose Wynter, Carlos Delano",8-8,Partido Cambio Democrático,"http://www.asamblea.gob.pa/fotdip/xH.D,P20FERNANDO_CARRILLO_PWC.jpg.pagespeed.ic.k5kCE-l7K8.jpg",2014,http://www.asamblea.gob.pa/diputados/
H.D. DANA D. CASTAÑEDA G.,"Pino Chanis, Gregori",2-3,Partido Cambio Democrático,http://www.asamblea.gob.pa/fotdip/xHD_DANA_CASTANEDA_PWC.jpg.pagespeed.ic.dPfUOtbSIw.jpg,2014,http://www.asamblea.gob.pa/diputados/
HD JOSÉ LUIS CASTILLO GÓMEZ,"Aguilera Franceschi, Carlos Eugenio",4-3,Partido Panameñista,"",2014,http://www.asamblea.gob.pa/diputados/
H.D. ELIAS ARIEL CASTILLO GONZALEZ,"Dutary Maylín, Jorge Enrique",8-8,Partido Revolucionario Democrático,http://www.asamblea.gob.pa/fotdip/xH.D_ELIAS_CASTILLO_PWC.jpg.pagespeed.ic.fpIvHhcazW.jpg,2014,http://www.asamblea.gob.pa/diputados/
H.D. MANUEL COHEN SALERNO,"Ríos Villalobos, Francisco Luis",6-1,Partido Cambio Democrático,http://www.asamblea.gob.pa/fotdip/xHD_MANUEL_COHEN_PWC.jpg.pagespeed.ic.MeDnLni_tB.jpg,2014,http://www.asamblea.gob.pa/diputados/
H.D. ARISTIDES DE ICAZA HIDALGO,"Starnes P. de De Icaza, Nubia",8-5,Partido Cambio Democrático,http://www.asamblea.gob.pa/fotdip/xHD_ARIS_DE_ICAZA_2PWC.jpg.pagespeed.ic.-Yk4edMmll.jpg,2014,http://www.asamblea.gob.pa/diputados/
H.D. RUBEN DE LEON SANCHEZ,"Tristán Benavides, José Gertrudis",9-1,Partido Revolucionario Democrático,"http://www.asamblea.gob.pa/fotdip/xHD_RUBEN,P20DE,P20LEON_PWC.jpg.pagespeed.ic.6GrrlDwcPR.jpg",2014,http://www.asamblea.gob.pa/diputados/
H.D. MARIA DEL CARMEN DELGADO BLANDON,"Corrales Frías, Abilio Anel",3-1,Partido Revolucionario Democrático,http://www.asamblea.gob.pa/fotdip/xHD_MARIA_DELGADO_PWC.jpg.pagespeed.ic.NKIDZIfzUO.jpg,2014,http://www.asamblea.gob.pa/diputados/
H.D. JOSE ANTONIO DOMINGUEZ ALVAREZ,"Domínguez Barahona, Jorge Aquiles",8-6,Partido Panameñista,http://www.asamblea.gob.pa/fotdip/xHD_JOSE_A_DOMINGUEZ_PWC.jpg.pagespeed.ic.wZDpbn3Si2.jpg,2014,http://www.asamblea.gob.pa/diputados/
H.D. MIGUEL FANOVICH,"Moreno González, José Bernardo",4-1,Partido Molirena,"http://www.asamblea.gob.pa/fotdip/xHD_MIGUEL,P20FANOVICH_PWC.jpg.pagespeed.ic.OVa1-aTeQH.jpg",2014,http://www.asamblea.gob.pa/diputados/
H.D. RUBEN DARIO FRIAS ORTEGA,"Frías O. de Herrera, Ana Tilsia",8-5,Partido Cambio Democrático,http://www.asamblea.gob.pa/fotdip/xHD_RUBEN_FRIAS_PWC.jpg.pagespeed.ic.jEEYrW7hgO.jpg,2014,http://www.asamblea.gob.pa/diputados/
H.D. SERGIO RAFAEL GALVEZ EVERS,"Lombana Franceschi, Diego Enrique",8-7,Partido Cambio Democrático,http://www.asamblea.gob.pa/fotdip/xHD_SERGIO_GALVEZ_PWC.jpg.pagespeed.ic.2O2H2F4-st.jpg,2014,http://www.asamblea.gob.pa/diputados/
H.D. VIDAL GARCIA,"García Palacio, José Luis",8-9,Partido Cambio Democrático,http://www.asamblea.gob.pa/fotdip/xHD_VIDAL_GARCIA_PWC.jpg.pagespeed.ic.ClM-Qp9F5t.jpg,2014,http://www.asamblea.gob.pa/diputados/
H.D. ANA MATILDE GOMEZ RUILOBA,"Spadafora Mejía, Alida",8-7,Independiente,http://www.asamblea.gob.pa/fotdip/xHD_ANA_M_GOMEZ_PWC.jpg.pagespeed.ic.PN5tOxGkwV.jpg,2014,http://www.asamblea.gob.pa/diputados/
H.D. PEDRO MIGUEL GONZALEZ PINZON,"Puga García, Carlos Enrique",9-3,Partido Revolucionario Democrático,"http://www.asamblea.gob.pa/fotdip/xH.D,P20PEDRO_M_GONZALEZ_PWC.jpg.pagespeed.ic.6GrHK1u2uh.jpg",2014,http://www.asamblea.gob.pa/diputados/
H.D. SAMIR GOZAINE ABDELMALAK,"Álvarez Herrera, Edgardo Dimas",4-1,Partido Revolucionario Democrático,http://www.asamblea.gob.pa/fotdip/xH.D_SAMIR_GOZAINE_PWC.jpg.pagespeed.ic.eTZSrrjZap.jpg,2014,http://www.asamblea.gob.pa/diputados/
H.D. NESTOR A. GUARDIA JAEN,"Ramos Tuñón, Daniel",2-1,Partido Panameñista,"http://www.asamblea.gob.pa/fotdip/xH.D,P20NESTOR_GUARDIA_PWC.jpg.pagespeed.ic.HpeQ7t8Jcw.jpg",2014,http://www.asamblea.gob.pa/diputados/
H.D. RAUL A. HERNANDEZ L,"León González, Eric Alberto",2-2,Partido Cambio Democrático,http://www.asamblea.gob.pa/fotdip/xHD_RAUL_HERNANDEZ_PWC.jpg.pagespeed.ic.IzN_CZrlqQ.jpg,2014,http://www.asamblea.gob.pa/diputados/
H.D. ABSALON HERRERA GARCIA,"Morris Arias, Ubaldino",10-2,Partido Cambio Democrático,"http://www.asamblea.gob.pa/fotdip/xH.D,P20ABSALON_HERRERA_PWC.jpg.pagespeed.ic.AdMjCv7vRF.jpg",2014,http://www.asamblea.gob.pa/diputados/
H.D. NELSON JACKSON PALMA,"Mack, Pascual",3-2,Partido Cambio Democrático,http://www.asamblea.gob.pa/fotdip/xHD_NELSON_JACKSON_PWC.jpg.pagespeed.ic.0RDvjZODoX.jpg,2014,http://www.asamblea.gob.pa/diputados/
H.D. MARIO AUGUSTO LAZARUS NAVALO,"Bennett Rivera, Samuel Ricardo",3-1,Partido Cambio Democrático,http://www.asamblea.gob.pa/fotdip/xHD_MARIO_LAZARUS_PWC.jpg.pagespeed.ic.Irku7hRN_D.jpg,2014,http://www.asamblea.gob.pa/diputados/
H.D. KATLEEN LEVY G,"Oda, Dimas Ascanio",8-10,Partido Panameñista,http://www.asamblea.gob.pa/fotdip/xHD_KATLEEN_LEVY_PWC.jpg.pagespeed.ic.PCkK4VyTvH.jpg,2014,http://www.asamblea.gob.pa/diputados/
H.D. MARIO B. MILLER L,"Baker Abrego, Celestino",1-1,Partido Cambio Democrático,http://www.asamblea.gob.pa/fotdip/xHD_MARIO_MILLER_PWC.jpg.pagespeed.ic.TllOio2OKy.jpg,2014,http://www.asamblea.gob.pa/diputados/
H.D. CARLOS ALBERTO MOTTA NUQUES,"Cano González, Alexis",4-2,Partido Revolucionario Democrático,"http://www.asamblea.gob.pa/fotdip/xHD_CARLOS_A_,P20MOTTA_PWC.jpg.pagespeed.ic.aFKJDyCjPH.jpg",2014,http://www.asamblea.gob.pa/diputados/
H.D. JUAN B. MOYA M,"",8-8,Partido Panameñista,http://www.asamblea.gob.pa/fotdip/xHD_JUAN_B_MOYA_PWC.jpg.pagespeed.ic.2CUoZX4PIV.jpg,2014,http://www.asamblea.gob.pa/diputados/
H.D. JOSE MUÑOZ MOLINA,"Muñoz M. de Ramírez, Mabia María",8-10,Partido Cambio Democrático,http://www.asamblea.gob.pa/fotdip/xHD_JOSE_MUNOZ_PWC.jpg.pagespeed.ic.qwcCyHNJiL.jpg,2014,http://www.asamblea.gob.pa/diputados/
H.D. JAVIER O. ORTEGA S,"Oro Solís de Torrijos, Vielka Edith",8-8,Partido Revolucionario Democrático,http://www.asamblea.gob.pa/fotdip/xHD_JAVIER_ORTEGA_PWC.jpg.pagespeed.ic.YvDdV5Xb7r.jpg,2014,http://www.asamblea.gob.pa/diputados/
H.D. AUSENCIO EUSEBIO PALACIO PINEDA,"Steel Beker de Jaén, Ceferina",12-1,Partido Revolucionario Democrático,http://www.asamblea.gob.pa/fotdip/xHD_AUSENCIO_PALACIO_PWC.jpg.pagespeed.ic.58ZAbAGF4J.jpg,2014,http://www.asamblea.gob.pa/diputados/
H.D. QUIBIAN TERIBE PANAY GONZALEZ,"Martínez Gordon, Miguel Ángelo",8-9,Partido Revolucionario Democrático,http://www.asamblea.gob.pa/fotdip/xHD_QUIBIAN_PANAY_PWC.jpg.pagespeed.ic.6LgtcUIBkb.jpg,2014,http://www.asamblea.gob.pa/diputados/
H.D. JAIME PEDROL GUERRA,"Bejerano Bejerano, Nicolás",12-2,Partido Revolucionario Democrático,http://www.asamblea.gob.pa/fotdip/,2014,http://www.asamblea.gob.pa/diputados/
H.D. ALFREDO VICTOR PEREZ DIA,"Ayola Thompson, Juan José",8-4,Partido Revolucionario Democrático,http://www.asamblea.gob.pa/fotdip/xHD_ALFREDO_PEREZ_PWC.jpg.pagespeed.ic.0ee7yPOaIL.jpg,2014,http://www.asamblea.gob.pa/diputados/
H.D. IVAN PICOTA BENITEZ,"Forero Gómez, Edgardo Alfonso",8-7,Partido Revolucionario Democrático,http://www.asamblea.gob.pa/fotdip/xHD_IVAN_PICOTA_PWC.jpg.pagespeed.ic.IKVf3DTtry.jpg,2014,http://www.asamblea.gob.pa/diputados/
H.D. RAUL GILBERTO PINEDA VERGARA,"Plata Hernández, Enrique Abdiel",8-6,Partido Revolucionario Democrático,http://www.asamblea.gob.pa/fotdip/xHD_RAUL_PINEDA_PWC.jpg.pagespeed.ic.hyiwVng2dC.jpg,2014,http://www.asamblea.gob.pa/diputados/
H.D. JUAN MANUEL POVEDA GUEVARA,"Martínez Guevara, Ernesto",9-4,Partido Cambio Democrático,http://www.asamblea.gob.pa/fotdip/xHD_JUAN_M_POVEDA_PWC.jpg.pagespeed.ic._yOQpFaAe6.jpg,2014,http://www.asamblea.gob.pa/diputados/
H.D. CRESCENCIA PRADO GARCIA,"Guerra Santos, Víctor",12-3,Partido Revolucionario Democrático,http://www.asamblea.gob.pa/fotdip/xHD_CRESCENCIA_PRADO_PWC.jpg.pagespeed.ic.ANBChA8_wi.jpg,2014,http://www.asamblea.gob.pa/diputados/
H.D. LUIS EDUARDO QUIROS,"Broce Urriola, Edison Augusto",8-8,Partido Panameñista,http://www.asamblea.gob.pa/fotdip/xHD_LUIS_E_QUIROS_PWC.jpg.pagespeed.ic.SLuMsDqYq5.jpg,2014,http://www.asamblea.gob.pa/diputados/
H.D. SALVADOR REAL CHEN,"Rosales Guainora, Naiper",5-2,Partido Cambio Democrático,http://www.asamblea.gob.pa/fotdip/xH.D_SALVADOR_REAL_PWC.jpg.pagespeed.ic.247GMRoae9.jpg,2014,http://www.asamblea.gob.pa/diputados/
H.D. JUAN MIGUEL RIOS GONZALEZ,"Vega Tello, Luis Alberto",6-3,Partido Panameñista,http://www.asamblea.gob.pa/fotdip/xHD_JUAN_MIGUEL_RIOS_PWC.jpg.pagespeed.ic.YxkBEVF_So.jpg,2014,http://www.asamblea.gob.pa/diputados/
H.D. BENICIO E. ROBINSON G,"Quintero Miranda, Mónica",1-1,Partido Revolucionario Democrático,http://www.asamblea.gob.pa/fotdip/xHD_BENICIO_ROBINSON_PWC.jpg.pagespeed.ic.x2_etwiLiZ.jpg,2014,http://www.asamblea.gob.pa/diputados/
H.D. ZULAY LEYSET RODRIGUEZ LU,"Sanjur Otero, César Diomedes",8-6,Partido Revolucionario Democrático,http://www.asamblea.gob.pa/fotdip/xHD_ZULAY_RODRIGUEZ_PWC.jpg.pagespeed.ic.juAFefrYCY.jpg,2014,http://www.asamblea.gob.pa/diputados/
H.D. JORGE ALBERTO ROSAS,"Guerra Atencio, Armando",4-6,Partido Panameñista,http://www.asamblea.gob.pa/fotdip/xHD_JORGE_A_ROSAS_PWC.jpg.pagespeed.ic.Sq-Zn2guql.jpg,2014,http://www.asamblea.gob.pa/diputados/
H.D. MIGUEL LORENZO SALAS OGLESBY,"Mitre Tejada, Juan Eloy",3-1,Partido Panameñista,http://www.asamblea.gob.pa/fotdip/xHD_MIGUEL_SALAS_PWC.jpg.pagespeed.ic.Y39ZorivfH.jpg,2014,http://www.asamblea.gob.pa/diputados/
H.D. NORIEL SALERNO ESTEVEZ,"Castillo Bernal, Noriel Abdiel",2-4,Partido Cambio Democrático,http://www.asamblea.gob.pa/fotdip/xHD_NORIEL_SALERNO_PWC.jpg.pagespeed.ic.R9Z2_llFYV.jpg,2014,http://www.asamblea.gob.pa/diputados/
H.D. CARLOS ELICEO SANTANA AIZPRUA,"Santana, Carlos A",9-1,Partido Panameñista,http://www.asamblea.gob.pa/fotdip/,2014,http://www.asamblea.gob.pa/diputados/
HD JUAN BAUTISTA SERRANO JIMENEZ,"Pérez Famanía, Jacobo",4-4,Partido Panameñista,"",2014,http://www.asamblea.gob.pa/diputados/
H.D. GABRIEL SOTO MARTINEZ,"Toribio Samaniego, Luis Adriano",8-1,Partido Panameñista,http://www.asamblea.gob.pa/fotdip/xHD_GABRIEL_SOTO_PWC.jpg.pagespeed.ic.I-nWATdm5R.jpg,2014,http://www.asamblea.gob.pa/diputados/
H.D. ADOLFO T. VALDERRAMA RODRIGUEZ,"Tejada Pérez, Santiago Alexis",8-7,Partido Panameñista,"http://www.asamblea.gob.pa/fotdip/xH.D,P20ADOLFO,P20VALDERRAMA_PWC.jpg.pagespeed.ic.wNTWC5XG15.jpg",2014,http://www.asamblea.gob.pa/diputados/
H.D. HECTOR VALDES CARRASQUILLA,"Lee Vásquez, Víctor Manuel",8-6,Partido Cambio Democrático,http://www.asamblea.gob.pa/fotdip/xHD_HECTOR_VALDES_CARRASQUILLA_PWC.jpg.pagespeed.ic.e6PKX8vgHt.jpg,2014,http://www.asamblea.gob.pa/diputados/
H.D. MARYLIN E. VALLARINO DE SELLHORN,"Sellhorn Carrillo, Agustín R.",8-1,Partido Cambio Democrático,http://www.asamblea.gob.pa/fotdip/xHD_MARYLIN_VALLARINO_PWC.jpg.pagespeed.ic.9GTjYBnW9g.jpg,2014,http://www.asamblea.gob.pa/diputados/
H.D. JOSE LUIS VARELA RODRIGUEZ,"Arosemena Athanasiadis, Alberto Aristides",6-2,Partido Panameñista,"http://www.asamblea.gob.pa/fotdip/xH.D,P20JOSE_LUIS,P20VARELA_PWC.jpg.pagespeed.ic.hIjbBhoAv9.jpg",2014,http://www.asamblea.gob.pa/diputados/
H.D. FELIPE VARGAS VARGAS,"Paz, Eduardo",5-1,Partido Revolucionario Democrático,http://www.asamblea.gob.pa/fotdip/xHD_FELIPE_VARGAS_PWC.jpg.pagespeed.ic.3tRZMdVqKE.jpg,2014,http://www.asamblea.gob.pa/diputados/
H.D. MARIELA DEL C. VEGA DE DONOSO,"Nelson Domínguez, Mario Eliecer",7-2,Partido Cambio Democrático,"http://www.asamblea.gob.pa/fotdip/xH.D,P20MARIELA_VEGA2_PWC.jpg.pagespeed.ic.dBdcOVNoy3.jpg",2014,http://www.asamblea.gob.pa/diputados/
H.D. AIBAN JESUS VELARDE,"Bolívar, Alex",10-1,Partido Revolucionario Democrático,http://www.asamblea.gob.pa/fotdip/xHD_AIBAN_VELARDE_PWC.jpg.pagespeed.ic.hLYUHHo51p.jpg,2014,http://www.asamblea.gob.pa/diputados/
H.D. DIOGENES VERGARA,"Navarro De Gracia, Milciades Osvaldo",8-10,Partido Revolucionario Democrático,http://www.asamblea.gob.pa/fotdip/xHD_DIOGENES_VERGARA_PWC.jpg.pagespeed.ic.a49M9dXZ3X.jpg,2014,http://www.asamblea.gob.pa/diputados/
H.D. EDWIN ALBERTO ZUÑIGA,"Gálvez Trujillo, Lucio",8-10,Partido Cambio Democrático,"http://www.asamblea.gob.pa/fotdip/xH.D,P20EDWIN_ZUNIGA_PWC.jpg.pagespeed.ic.R3ilpE1clp.jpg",2014,http://www.asamblea.gob.pa/diputados/
